sample_id,error_type,hint_level,hint_level_compliance,no_solution_leakage,judge_quality_score,judge_rationale
eval_csv_01,grouping_error,4,0.3000,1.0000,0.0000,"The generated hint does not provide a template (level 4) and does not match the reference hint at all. It asks a vague question about GROUP BY instead of giving a concrete query template, and it is unrelated to the reference 'SELECT * FROM products;' thus it fails on correctness, pedagogical relevance, and hint level."
eval_csv_02,grouping_error,1,1.0000,1.0000,0.9000,"The hint correctly addresses the grouping error by prompting the student to reconsider the use of GROUP BY, which aligns with the attention level. It is pedagogically sound, encouraging reflection without giving away the answer. Minor deviation from the reference's brevity, but still appropriate."
eval_csv_03,column_error,1,1.0000,1.0000,0.9000,"The hint correctly follows level‑1 (Attention) by gently directing the student to review the SELECT clause without giving the solution. It is pedagogically supportive and relevant to the column_error, though it could be slightly more specific about the column issue."
eval_csv_04,grouping_error,2,0.5000,1.0000,0.0000,The generated hint does not address the reference hint's content or the grouping_error; it fails to provide a category-level hint and is unrelated to the expected SQL example.
eval_csv_05,syntax_error,3,0.8000,1.0000,0.4000,"The hint correctly identifies the syntax error (misspelled SELECT) and uses an encouraging tone, which is pedagogically sound. However, the target hint level 3 requires providing an example of the correct query, which the generated hint fails to do. It only points out the error without showing the proper syntax, so it falls short of the required hint level."
eval_csv_07,column_error,2,0.5000,1.0000,0.2000,"The generated hint is overly generic praise and suggests reviewing the SELECT clause, which corresponds to an attention‑level hint (level 1). It does not address the specific column_error category, nor does it guide the student toward correct column naming or aliasing as the reference does. Therefore it fails to meet the target level 2 requirement and offers little pedagogical value for the error type."
eval_csv_08,grouping_error,2,0.5000,1.0000,0.2000,"The hint is vague and does not explain the specific category of the error (grouping misuse). It merely points to a GROUP BY clause without clarifying why it’s wrong or what the correct approach is, falling short of a level‑2 (Category) hint."
eval_csv_09,syntax_error,1,1.0000,1.0000,0.9500,"The hint correctly identifies the syntax error by drawing attention to the misspelled keyword `SELCT`, aligns with the Attention level (1) by focusing on the start of the statement without providing the full solution, and uses encouraging language. It is pedagogically appropriate and accurate."
eval_csv_10,column_error,4,0.3000,1.0000,0.2000,"The generated hint is overly generic and does not address the column_error or provide a level‑4 template. It lacks the concrete guidance or placeholder structure needed to help the student correct the query, falling far short of the reference hint."
eval_csv_11,column_error,3,0.3000,1.0000,0.1200,"The hint is generic encouragement and suggests reviewing the SELECT clause, but it does not provide an example query (required for level 3) nor directly address the column_error. It fails to meet the target hint level and lacks pedagogical specificity."
eval_csv_12,syntax_error,3,0.3000,1.0000,,API error: Expecting property name enclosed in double quotes: line 2 column 1 (char 2)
eval_csv_13,grouping_error,4,0.3000,1.0000,0.2000,"The hint is a vague prompt about GROUP BY rather than a concrete template (level 4). It does not give a fill‑in‑the‑blank query or structure, and it lacks the specific guidance shown in the reference. Hence it falls short of the required hint level and pedagogical usefulness."

AVERAGE,,,0.5667,1.0000,0.3700,

TAXONOMY_COVERAGE,3/11,27%
